http://en.wikipedia.org/wiki/List_of_music_featured_on_Doctor_Who		"Songs, classical music and popular tunes"	3	Notes	A clip from Top of the Pops showing The Beatles performing was used. Vicki, who is from the 25th century, regards the song as classical music.___Lynda Baron later appeared onscreen as Captain Wrack in the Fifth Doctor serial Enlightenment. Specially composed for the episode.___Played in the Inferno Club.___Stock music from the album The Mood Modern released in 1966. Played in the Inferno Club.___Stock music from the album The Mood Modern released in 1966. Played in the Inferno Club.___Stock music from the album The Mood Modern released in 1966. Played in the Inferno Club."	"A clip from Top of the Pops showing The Beatles performing was used. Vicki, who is from the 25th century, regards the song as classical music.___Stock music from the album The Mood Modern released in 1966. Played in the Inferno Club."	-0.734042553	0
http://en.wikipedia.org/wiki/List_of_tallest_buildings_in_Detroit		Tallest buildings	6	Notes	Tallest building completed in Detroit in the 1990s. Former headquarters of Comerica Bank.___When completed in 1928, the Penobscot was the world's eighth tallest building. It was the city's tallest from 1928 to 1977. The Penobscot stands at the center of the Detroit Financial District.___In January 2010, developer Key Investment Group reported it is pursuing plans for a major renovation of the Book Tower.___Tallest building completed in Detroit in the 1980s. Also known as the Madden Building.___Tallest building completed in the city in the 1960s.___Fully renovated in 2012 as a mixed- use residential building. The project created residential units on floors 5-34, with the lower 4 floors dedicated to retail, entertainment, and office space. Originally known as the Eaton Tower.___Tallest hotel in the world upon completion in 1924 and restored in 2008.___Tallest building completed in Detroit in the 1930s.___Tallest building completed in the city in the 1950s."	"Fully renovated in 2012 as a mixed- use residential building. The project created residential units on floors 5-34, with the lower 4 floors dedicated to retail, entertainment, and office space. Originally known as the Eaton Tower.___Tallest hotel in the world upon completion in 1924 and restored in 2008."	-0.734693878	0
http://en.wikipedia.org/wiki/State_Administration_of_Taxation		Organization	1	Functions & Divisions	consisting of Division of Comprehensive Affairs, Tax Reform Division, Legislative Division and Appeal Division___( in charge of the administration of VAT, Consumption Tax and Business Tax): consisting of Comprehensive Division, VAT Division, Consumption Tax Division and Business Tax Division___(in charge of administration of Enterprise Income Tax and Individual Income Tax): consisting of Comprehensive Division, Central Enterprise Income Tax Division, Local Enterprise Income Tax Division and Individual Income Tax Division___(in charge of administration of Resource Tax, City and Township Land Use Tax, City Maintenance and Construction Tax, Fixed Assets Investment Orientation Regulation Tax, Land Appreciation Tax, House Property Tax, Vehicle and Vessel Usage Tax, Stamp Tax, Slaughter Tax and Banquet Tax): consisting of Comprehensive Division, Local Tax Division I, Local Tax Division II and Local Tax Division III;___(in charge of administration of Agriculture Tax, Animal Husbandry Tax, Deed Tax and Farmland Occupation Tax): consisting of Comprehensive Division, Agriculture Tax Division I and Agriculture Tax II___(Offshore Oil Tax Bureau): consisting of Comprehensive Tax Policy Division, Tax Administration Division, Anti-Tax Avoidance Division, Offshore Oil Tax Division, International Tax Treaty Division, Foreign Affairs Division and Foreign Cooperative Division;___( responsible for VAT and Consumption Tax on importation and exportation ): consisting of Comprehensive Division, Import Tax Division and Export Tax Division;___consisting of Comprehensive Division, Tax Propaganda Division, Invoice Management Division and Open Market Tax Division;___consisting of Comprehensive Division, Procedure Division, Investigation Division I and Investigation Division II___consisting of Funding Division, Infrastructure Division and Equipment Division;___consisting of Comprehensive Division, Planning Division, Statistical Division and Macro-Analysis Division;___consisting of Comprehensive Division Personnel Division for Headquarters, Personnel Division for Local Offices, Recruit Division and Grass-root Work Division; and___(representative office of Supervision Ministry):consisting of Secretariat Division, Discipline Inspection and Supervision Division and Division for Letters of Complaints."	"consisting of Division of Comprehensive Affairs, Tax Reform Division, Legislative Division and Appeal Division___(in charge of administration of Enterprise Income Tax and Individual Income Tax): consisting of Comprehensive Division, Central Enterprise Income Tax Division, Local Enterprise Income Tax Division and Individual Income Tax Division"	-0.7375	0
http://en.wikipedia.org/wiki/List_of_automobile_sales_by_model		B	2	Production	387,283 made under the brand names of Austin, Morris, MG, Riley, Vanden Plas and Wolseley.___Over 9,500,000 in the first four generations to 2005. The bestselling vehicle from a premium brand.___1,000,000 in two generations up to June 2010.___38 in a single generation.___8 in a single generation.___139 in a single generation.___300th base model 16.4 sold by June-2011 within a single generation.___112,901 produced.___110,809 built.___Approximately 3,170,000 produced over six generations including the 1980-1990 Electra Estate.___186,507 built over two generations.___Buick's best selling and longest lasting nameplate; over 6,000,000 built over eight generations.___1,127,261 built over eight generations.___Approximately 3,890,000 built over nine generations.___492,040 produced over two generations."	"300th base model 16.4 sold by June-2011 within a single generation.___Buick's best selling and longest lasting nameplate; over 6,000,000 built over eight generations."	-0.736842105	0
http://en.wikipedia.org/wiki/Visa_requirements_for_Swedish_citizens		Africa	1	Conditions of access	A free 24 h transit visa issued upon arrival at the airport. Within 24 hours this must be converted into a full visa at the immigration office in Moroni (fee payable) [2]___1-month visa can be obtained upon arrival for DJF5,000 [3]___30-day visa issued upon arrival for US$20 [4]___3-month tourist visa issued upon arrival (Addis Ababa Airport only; US$40) [5]___90 days [6]___3-month visa may be issued upon arrival (may cause delays - pre-arrival visa strongly recommended) [7][8]___14 days [9]___90-day visa issued upon arrival for MGA 140,000; visa obtained prior to arrival strongly recommended [10]___90 days [11]___6 months in a year (tourist), 90 days in a year (business) [12][13]___3 months [14]___3 months [15]___30-day visa issued upon arrival for US$25 [16][17]___3 months [18]___unlimited access [19]___3 months [20]___90 days___1 month [21]___90 days [22]___60 days [23]___3 month visa issued upon arrival for USD 50 [24][25]___7-day visa can be obtain upon arrival for XOF10,000~35,000 [26]___3 months [27]___3 month visa can be obtained upon arrival for USD 50 [28][29]___3 month visa issued upon arrival (single entry visa fee USD 50) [30][31]___3-month holiday/1-month business visa issued upon arrival for USD 30 ~ 55 [32]"	"3-month tourist visa issued upon arrival (Addis Ababa Airport only; US$40) [5]___90-day visa issued upon arrival for MGA 140,000; visa obtained prior to arrival strongly recommended [10]"	-0.735294118	0
http://en.wikipedia.org/wiki/FedEx_Air_%26_Ground_NFL_Players_of_the_Week		2011 FedEx Air winners	4	Key statistics and notes	Stafford completed 23 of 39 passes for 294 yards, four touchdowns and one interception in the Lions' 48-3 win over the Chiefs.___Flacco completed 27 of 48 passes for 389 yards and three touchdowns in the Ravens' 37-7 victory over the Rams.___Rodgers completed 29 of 38 passes for 408 yards, four touchdowns and an interception in a 49-23 win over the Broncos.___Rodgers threw for 396 yards and two scores in the Packers' 25-14 victory over the Falcons.___Rodgers threw for 310 yards, three touchdowns and an interception in the Packers' 24-3 win over the Rams.___Rodgers completed 24 of 30 passes for 335 yards and three touchdowns in the Packers' 33-27 win over the Vikings.___Roethlisberger completed 36 of 50 passes for 365 yards, two touchdowns and one interception in the Steelers' 25-17 win over the Patriots.___Rodgers converted 80.8 percent of his pass attempts for 247 yards and four scores in the Packers' 45-38 win over the Chargers.___Romo completed 23 of 26 passes for 270 yards and 3 touchdowns in Cowboys' 44-7 win over the Bills.___Stafford completed 28 of 36 passes for 336 yards, 5 touchdowns and 2 interception in Lions' 49-35 win over the Panthers.___Brees completed 24 of 38 passes for 363 yards and four touchdowns in a 49-24 win over the Giants.___Rodgers completed 28 of 46 passes for 369 yards, 4 touchdowns and 1 interception in a 38-35 win over the Giants.___Ryan completed 22 of 38 passes for 320 yards and 4 touchdowns in a 31-23 win over the Panthers.___Brees completed 32 of 40 passes for 412 yards and five touchdowns in a 42-20 win over the Vikings.___Brees completed 23 of 39 passes for 307 yards, 4 touchdowns and 2 interceptions in a 45-16 win over the Falcons. During this game, Brees broke the all-time season yardage record by a quarterback, passing Dan Marino's previous mark.___Backup quarterback Matt Flynn completed 31 of 44 passes for Packers' record 480 yards and 6 touchdowns, and 1 interception."	"Rodgers threw for 396 yards and two scores in the Packers' 25-14 victory over the Falcons.___Brees completed 23 of 39 passes for 307 yards, 4 touchdowns and 2 interceptions in a 45-16 win over the Falcons. During this game, Brees broke the all-time season yardage record by a quarterback, passing Dan Marino's previous mark."	-0.739837398	0
http://en.m.wikipedia.org/wiki/Ancestry.com		Products and servicesEdit	3	Edition/s	DOS___Windows 3.1 / DOS___Windows 3.1 / DOS___Windows 3.1 & 95 (16 bit) / DOS___Windows 3.1 & 95 (16 bit & 32 bit) / DOS___Macintosh (PowerPC processor only)___Windows 3.1 & 95 (16 bit & 32 bit) / DOS___Windows___Mac OSX 10.5 or later (Intel-based Mac)	Windows 3.1 & 95 (16 bit & 32 bit) / DOS___Macintosh (PowerPC processor only)	-0.730337079	0
http://en.wikipedia.org/wiki/PowerBook_G3		Models	2	5-6 May 1998	24-bit 800x600, 12.1"" passive matrix or 1024x768 13.3/14.1"" TFT___PowerPC 750 ""G3"", 233/250/292 MHz"	"24-bit 800x600, 12.1"" passive matrix or 1024x768 13.3/14.1"" TFT___PowerPC 750 ""G3"", 233/250/292 MHz"	-0.743362832	0
http://en.wikipedia.org/wiki/12th_National_Television_Awards		Awards	2	Also nominated	Sue Cleaver (Coronation Street) Lacey Turner (EastEnders) Ursula Holden-Gill (Emmerdale) Evangeline Lilly (Lost)___Bad Girls (ITV) Desperate Housewives (Channel 4) Lost (Channel 4)___Coronation Street (ITV) Emmerdale (ITV) Hollyoaks (Channel 4)___Ant & Dec's Saturday Night Takeaway (ITV) Dancing on Ice (ITV) Friday Night with Jonathan Ross (BBC) Strictly Come Dancing (BBC)___Celebrity Big Brother (Channel 4) I'm a Celebrity... Get Me Out of Here! (ITV) The Apprentice (BBC)___Davina McCall (Big Brother) Jonathan Ross (Friday Night with Jonathan Ross) Noel Edmonds (Deal or No Deal) Paul O'Grady (The New Paul O'Grady Show)___Neighbours (BBC) The New Paul O'Grady Show (Channel 4) This Morning (ITV)___Carol Thatcher (I'm a Celebrity... Get Me Out of Here!) Chantelle Houghton (Celebrity Big Brother) Pete Bennett (Big Brother) Richard Fleeshman (Soapstar Superstar)___8 out of 10 Cats (Channel 4) Have I Got News for You (BBC) Who Wants to Be a Millionaire? (ITV)___My Family (BBC) The Catherine Tate Show (BBC) Will & Grace (Channel 4)___Bad Lads Army: Officer Class (ITV) Planet Earth (BBC) Supernanny (Channel 4)___Nikki Patel (Coronation Street) Jenna-Louise Coleman (Emmerdale) Andrew Moss (Hollyoaks)	Davina McCall (Big Brother) Jonathan Ross (Friday Night with Jonathan Ross) Noel Edmonds (Deal or No Deal) Paul O'Grady (The New Paul O'Grady Show)___8 out of 10 Cats (Channel 4) Have I Got News for You (BBC) Who Wants to Be a Millionaire? (ITV)	-0.745614035	0
http://de.wikipedia.org/wiki/Small_Outline_Dual_In-line_Memory_Module		Spezifikationen	2	Bezeichnung	DRAM SO-DIMM___DRAM SO-DIMM___SDRAM SO-DIMM___SGRAM/SDRAM SO-DIMM Family___DDR SGRAM SO-DIMM___PC133 SDRAM Unbuffered SO-DIMM___PC-2700/PC-2100/PC-1600 Unbuffered SO-DIMM SDRAM___DDR2 SDRAM Unbuffered SO-DIMM___EP2-2100 DDR2 SDRAM 32b SO-DIMM___DDR3 SDRAM Unbuffered SO-DIMM Design Specification, Rev 2.0.___EP3-6400/EP3-8500/EP3-10600/EP3-12800 DDR3 SDRAM 72b-SO-DIMM"	SGRAM/SDRAM SO-DIMM Family___EP3-6400/EP3-8500/EP3-10600/EP3-12800 DDR3 SDRAM 72b-SO-DIMM	-0.73255814	0
http://de.wikipedia.org/wiki/Abk%C3%BCrzungen_in_der_Kabeltechnik		Abk??rzungen	2	Beschreibung	(Niederspannung) 250V/300V___(Niederspannung) 300V/500V___(Niederspannung) 500V/700V___(Niederspannung) 600V/1000V___Mittelspannungsbereich von 1000V (1kV) bis 36000V (36kV)	(Niederspannung) 250V/300V___Mittelspannungsbereich von 1000V (1kV) bis 36000V (36kV)	-0.735632184	0
http://en.wikipedia.org/wiki/List_of_Avengers_members		Marvel NOW! recruits (2012-2013)	3	Notes	Automatically on team after assuming Peter Parker's body. Under probation since The Superior Spider-Man #8 for various violent acts.___Current members of the main Avengers team.___Current member of the Avengers Unity Squad. Maintains simultaneous membership in the Avengers and the X-Men.___Current member of the Avengers Unity Squad.	Automatically on team after assuming Peter Parker's body. Under probation since The Superior Spider-Man #8 for various violent acts.___Current member of the Avengers Unity Squad. Maintains simultaneous membership in the Avengers and the X-Men.	-0.730337079	0
http://en.wikipedia.org/wiki/Toni_Gonzaga		Awards	1	Awards & Recognitions	Best Comedy Actress___Best Female TV Host (ASAP '06)___Princess of Philippine Movies (""You Are the One"")___Most Admired Female TV Personality___100 Prettiest - siblings (with Alex Gonzaga)___Best Female Host (ASAP XV)___Princess of Philippine Movies (""My Amnesia Girl"")___Female Concert Performer of the Year (""Toni @ 10: The Anniversary Concert"")___Outstanding Female Showbiz Talk Program Host"	"100 Prettiest - siblings (with Alex Gonzaga)___Female Concert Performer of the Year (""Toni @ 10: The Anniversary Concert"")"	-0.730337079	0
http://en.wikipedia.org/wiki/Mirrorless_interchangeable-lens_camera		Systems comparison	4	Stabilization	Lens-based___none___Lens-based (Panasonic); In body (Olympus) Olympus EM-5 1st 5 axis stability system versus traditional 2 axis___Lens-based___Sensor-based___Sensor-based___depends___Lens-based___Lens-based___Lens-based	none___Lens-based (Panasonic); In body (Olympus) Olympus EM-5 1st 5 axis stability system versus traditional 2 axis	-0.7375	2
http://en.m.wikipedia.org/wiki/List_of_James_Bond_firearms		NovelsEdit	2	Firearms	9mm Beretta, sidearm of Zoltan the Magyar Unknown rifle, picked up by Bond during a firefight but not fired as it wasn't loaded. Thompson submachine gun, supplied to Ugo Carnifex by Zoltan the Magyar.___Apache, used by the Smith brothers on numerous occasions. Also unnamed pistols picked up from the sailors___MP 28, used by El Huracan's men. Unknown revolver, used by Bond who picked it up from a dead Mexican police officer. Unknown rifle, used by Mexican soldiers and Mrs Glass henchmans.___Tokarev TT-33, used by Cristo Orabessa. Enfield revolver, used by Bond while escaping Baron von Schlicks castle. Luger P08 pistol, favored weapon of Vladimir Wrangel."	"9mm Beretta, sidearm of Zoltan the Magyar Unknown rifle, picked up by Bond during a firefight but not fired as it wasn't loaded. Thompson submachine gun, supplied to Ugo Carnifex by Zoltan the Magyar.___Tokarev TT-33, used by Cristo Orabessa. Enfield revolver, used by Bond while escaping Baron von Schlicks castle. Luger P08 pistol, favored weapon of Vladimir Wrangel."	-0.735042735	0
http://zh.wikipedia.org/wiki/%E6%B8%A9%E7%89%B9%E6%B2%83%E6%96%AF%C2%B7%E7%B1%B3%E5%8B%92		????????????	4	??????	1x06: ""The Time the Truth Was Told"" 1x11: ""The Time They Got E-Rotic""___season 1, episodes 16 (""All About Adam"") and 18 (""Ch-Ch-Changes"")___season 7, episode 1 (""Homecoming"")___season 2, episodes 21 (""Common Thread"") and 22 (""Something Wicked This Way Comes"")___season 1, episode 1 (""Pilot"")___Prison Break___11x01: ""Unstable"""	"1x06: ""The Time the Truth Was Told"" 1x11: ""The Time They Got E-Rotic""___season 1, episodes 16 (""All About Adam"") and 18 (""Ch-Ch-Changes"")"	-0.726415094	0
http://en.wikipedia.org/wiki/German_Armed_Forces_casualties_in_Afghanistan		Chronology of incidents	4	Situation Note: Ranks and unit names are listed in English for better understanding	An IED attack against a German convoy on its route in Kunduz province injured three German soldiers and killed one bystander___A Monitoring and Observation Liaison Team (MOLT) of PRT Faizabad was ambushed during a night patrol halt. The attackers were repelled in an exchange of fire. The ambush left three Germans wounded___A suicide bomb attack on a US Forces convoy in Kabul killed several bystanders. A German vehicle within the convoy was heavily damaged, its driver suffered minor injuries___An attack with small arms and RPGs on a German night patrol in Kunduz Province injured three German servicemen. During the firefight, a Fennek LSG and two other vehicles were lost due to damage. Several attackers were wounded or killed.___One soldier was killed when handling live ammunition. Fatality: Staff Sergeant Christian Kopp, Artillery Reconnaissance Battalion 121"	An IED attack against a German convoy on its route in Kunduz province injured three German soldiers and killed one bystander___A Monitoring and Observation Liaison Team (MOLT) of PRT Faizabad was ambushed during a night patrol halt. The attackers were repelled in an exchange of fire. The ambush left three Germans wounded	-0.73255814	0
http://en.m.wikipedia.org/wiki/Agastya		Contrast between Northern and Southern TraditionsEdit	1	Southern(Dravidian Tamil) Traditions	Clears the Forest___Promotes agriculture and Irrigation.___Leader of the Velir Clan___The greatest exponent of Tamil Language;author of the earliest Tamil grammar___Linked to the Indian Historical Tradition of(a)Ventar-Velir-Velalar hierarchy of Tamil Sangam Polity (b)Dravidian ruling classes claiming descend from a pitcher (c)Yadavas,and (through them) the Andha-Kura-Vrishni-Bhoja tribes of the Mahabharata Age"	"Clears the Forest___Linked to the Indian Historical Tradition of(a)Ventar-Velir-Velalar hierarchy of Tamil Sangam Polity (b)Dravidian ruling classes claiming descend from a pitcher (c)Yadavas,and (through them) the Andha-Kura-Vrishni-Bhoja tribes of the Mahabharata Age"	-0.741573034	2
http://nl.wikipedia.org/wiki/Lijst_van_rijksmonumenten_in_Steenwijk			2	Bouwjaar	oorspr. vanaf ca. 1000 huidige vorm: 1409-ca. 1500 (in fasen) herst. in 1604, 1914 en 1930-'32 1974-'81 (rest.)___oorspr. vanaf 1296 huidige vorm: 1477 (herb. of verb.) 1850-1900 (uitbr. toren) 1951-'59 (rest.)___1900-'01___1880___1880 1992 (verb.)___1882-'83"	"oorspr. vanaf ca. 1000 huidige vorm: 1409-ca. 1500 (in fasen) herst. in 1604, 1914 en 1930-'32 1974-'81 (rest.)___1880"	-0.733333333	2
http://en.wikipedia.org/wiki/List_of_pharaohs		Late period	2	Comments	Reunified Egypt. Son of Necho I and father of Necho II.___Most likely the pharaoh mentioned in several books of the Bible. Son of Psamtik I and father of Psamtik II.___Son of Necho II and father of Apries.___Fled Egypt after Amasis II (who was a general at the time) declared himself pharaoh following a civil war. Son of Psamtik II.___He was the last great ruler of Egypt before the Persian conquest. According to the Greek historian Herodotus, he was of common origins. Father of Psamtik III.___Son of Amasis II. Ruled for about six months before being defeated by the Persians in the Battle of Pelusium and subsequently executed."	"Son of Necho II and father of Apries.___He was the last great ruler of Egypt before the Persian conquest. According to the Greek historian Herodotus, he was of common origins. Father of Psamtik III."	-0.74025974	0
